Fellow	Year	Citation
Akshay Rathore	2021	For contributions to the design and advancement of power electronics for drives and automotive industries 
N Rau	1998	For contributions to the techniques of reliability and production cost computations in electric power systems. 
Stewart Rauch	2019	For contributions to microelectronics reliability 
Lawrence Rauchwerger	2012	For contributions to thread-level speculation, parallelizing compilers, and parallel libraries 
James Rautio	2000	For development of practical electromagnetic analysis techniques. 
Umberto Ravaioli	2003	For contributions to Monte Carlo simulation of electron devices. 
R Ray	2000	For contributions to power systems communications and protective relaying systems. 
Asok Ray	2002	For contributions to aerospace and electromechanical systems. 
Gregory Raybon	2016	For contributions to high-speed optical communication systems 
Dipankar Raychaudhuri	1995	For contributions to the areas of multiple-access packet networks and digital video technology. 
Daniel Razansky	2022	For contributions to multispectral optoacoustic tomography 
Behzad Razavi	2003	For contributions to high-speed communication circuits. 
Adel Razek	1999	For contributions to 3D electromagnetic field modelling and coupled phenomena analysis in electromagnetic systems. 
John Reagan	1988	For accomplishments in lidar and solar radiometric atmospheric sensing, and for contributions to electrical engineering education. 
Gabriel Rebeiz	1997	For the development of novel microwave and millimeter-wave antennas, receivers and circuits using micromachining techniques. 
Sherief Reda	2023	For contributions to energy-efficient and approximate computing 
Harnatha Reddy	1992	For contributions to multivariable circuit theory and its application to multidimensional stability analysis and digital filter design. 
C Reddy	2018	For leadership in simulation methods for antenna placement and co-site analysis 
A L Narasimha Reddy	2010	For contributions to multimedia storage and network support 
Sudhakar Reddy	1987	For contributions to the design of testable digital logic circuits and fault-tolerant computing. 
Vellenki Reddy	1999	For contributions to adaptive spectral estimation and eigensubspace estimation. 
Raj Reddy	1983	 
Wanda Reder	2012	For leadership in power engineering implementation and workforce development 
G Redinbo	1997	For contributions to fault-tolerant design methods applicable to computer and communication systems. 
Richard Redl	2008	For contributions to the design and application of power electronic circuits 
William Redman-White	2014	For contributions to chip design aspects of telecommunications systems and RFIC design 
Robert Reed	2014	For contributions to understanding the effects of single-event particle radiation on integrated circuits 
Jeffrey Reed	2005	For contributions to software radio and communications signal processing and for leadership in engineering education. 
Mark Reed	2009	For contributions to nanoscale and molecular-scale electronic devices 
Edward Reedy	1991	For technical leadership and contributions to developing and exploiting the millimeter wavelengths in radar applications. 
Gamal Refai-Ahmed	2021	For leadership in thermal management of electronics product development 
Leonard Register	2016	For contributions to modeling of charge transport in nanoscale CMOS devices 
William Regli	2017	For contributions to 3D search, design repositories and intelligent manufacturing 
T Regulinski	1984	For contributions to research and education in reliability. 
Christian Rehtanz	2023	For contributions to wide area monitoring, protection and control systems for electrical power grids 
Johan Reiber	2005	For contributions to medical image analysis and its applications. 
Amy Reibman	2005	For contributions to the transport of video over networks. 
Herbert Reichl	2001	For contributions to microelectronic packaging. 
Clayton Reid	2003	For contributions to medium voltage motor control technology. 
Rafael Reif	1993	For pioneering work in the low-temperature epitaxial growth of semiconductor thin films. 
Andreas Reigber	2016	For contributions to SAR tomography and airborne multi-band SAR 
J-Patrick Reilly	1999	For contributions to the understanding of biological response to electric current and electromagnetic fields with application to medical devices and safety standards. 
Ulrich Reimers	2006	For contributions to the development of Digital Video Broadcasting (DVB). 
Joseph Reinhardt	2020	For contributions to medical image processing and analysis 
Robert Reinovsky	2003	For contributions to pulsed power science and technology. 
Sorel Reisman	2022	For leadership in design, implementation and adoption of open education resources 
Martin Reisslein	2014	For contributions to the design and performance evaluation of metropolitan networks and multimedia networking mechanisms 
Michael Reiter	2014	For contributions to computer security and fault-tolerant distributed computing 
Johann Reithmaier	2011	For research in active semiconductor nanostructures 
Reza Rejaie	2017	For contributions to multimedia and peer-to-peer networking, and Internet measurement 
Kate Remley	2013	For contributions to calibration and measurement of wireless communication systems 
Haoxing Ren	2024	For contribution to physical synthesis of integrated circuits 
Wei Ren	2016	For contributions to distributed coordination and control of multi-agent systems 
Kui Ren	2016	For contributions to security and privacy in cloud computing and wireless networks 
Stephen Renals	2014	For contributions to speech recognition technology and its use in spoken language processing 
Markku Renfors	2008	For contributions to digital signal processing algorithms 
Michel Renovell	2013	For contributions to failure analysis and to defect-oriented tests of digital and analog circuits and systems 
Bruce Renz	1997	For leadership in management of engineering projects associated with large power projects and extra-high voltage transmission systems. 
Aristides Requicha	1992	For contributions to the theory and practice of three-dimensional geometric modeling, and to its applications in programmable automation. 
Spiridon Reveliotis	2015	For contributions to discrete event systems for resource allocation 
Jennifer Rexford	2018	For contributions to the management of networks and associated routing systems 
Douglas Reynolds	2010	For contributions to Gaussian-mixture-model techniques for automatic speaker recognition 
Edward Rezek	2001	For contributions to GaAs and InP monolithic microwave integrated circuits and optoelectronic devices. 
Woogeun Rhee	2023	For contributions to phase-locked circuits and systems 
Jin Koo Rhee	2010	For contributions to Gallium Arsenide, Microwave and Millimeter-wave Monolithic Integrated Circuits 
Walden Rhines	2017	For leadership and technology innovation in integrated circuit design and automation 
Charles Rhoads	2017	For leadership in low cost and high performance array antenna technologies 
V Rhyne	1990	For contributions to the discipline of computer engineering and to computer engineering education. 
Sedki Riad	1992	For contributions to time-domain measurement s through physical modeling of sampling devices. 
Paulo Ribeiro	2003	For contributions to the understanding of harmonic penetration in transmission systems, and advancement of superconducting magnetic energy storage system applications. 
Giuseppe Riccardi	2010	For contributions to algorithms for automatic speech recognition and spoken language processing 
Daniele Riccio	2014	For contributions to satellite-based synthetic aperture radar imaging 
Michael Rice	2017	For contributions to communication waveforms, detection algorithms, and channel models for aeronautical telemetry 
Gael Richard	2017	For contributions to analysis, indexing and decomposition of audio and music signals 
John Richards	1996	For scientific contributions in the fields of earth observational remote sensing. 
Mark Richards	2012	For contributions in radar signal processing education 
John Richardson	1965	For contributions to atomic frequency and time interval standards. 
Martin Richardson	2014	For contributions to the development and application of high-power and ultrafast lasers 
Thomas Richardson	2007	For contributions to coding theory and practice 
David Richardson	2015	For contributions to optical fiber technology 
Paul Richman	1982	For contributions to the theoretical analysis, development, and manufacture of large scale integrated circuits. 
Christ Richmond	2020	For contributions to adaptive array processing algorithms 
Kurt Richter	2005	For contributions to the theory and application of computational electromagnetics. 
Nick Ridler	2014	For contributions to traceability in precision high-frequency electromagnetic measurements 
George Ridley	2020	For contribution to stator core insulation condition analysis in large hydroelectric generators 
Jae-Sung Rieh	2020	For contributions to silicon-germanium integrated circuits for wireless communications 
Rasheek Rifaat	2015	For contributions to protection of industrial power systems 
Brian Rigling	2018	For contributions to synthetic aperture radar imaging 
Gerhard Rigoll	2019	For contributions to multimodal human-machine communication 
William Riley	2003	For contributions to high performance rubidium gas cell frequency standards and stability analysis. 
Michael Riley	2018	For contributions to automatic speech recognition using Weighted Finite-State Transducers 
Douglas Riley	2010	For contributions to time-domain techniques in computational electromagnetics 
Chuntaek Rim	2020	For contributions to wireless power transfer for electric vehicles and mobile devices 
Bixio Rimoldi	2000	For contributions to multiple-access information theory. 
Robert J Ringlee	1974	For contributions to practical methods for assessing and improving reliability of power apparatus and systems. 
John Ringwood	2024	For contributions to wave energy conversion systems 
Charles Rino	1989	For contributions in wave propagation in continuous and discrete random media and ionosphere physics. 
Eve Riskin	2009	For contributions to variable-rate image and video compression and to engineering education 
James Ritcey	2011	For contributions to bit-interleaved coded modulation with iterative decoding 
Stefan Ritt	2016	For the development of the Domino Ring Sampler series of chips 
Jerome Rivard	1987	For leadership in the production and implementation of electronic control systems for vehicles. 
Nabeel Riza	2007	For contributions to acousto-optic, liquid crystal, and micromirror device applications in photonic signal processing and controls 
Farouk Rizk	1982	For contributions to the science of high-voltage technology and for technical leadership in the advancement of the electrical power industry. 
Giorgio Rizzoni	2004	For leadership in automotive control systems. 
Laura Roa	2003	For contributions to new resuscitation therapies for burn patients that are based on mathematical modeling, simulation, and control techniques. 
Yves Robert	2006	For contributions to the design and analysis of parallel algorithms and scheduling techniques. 
Thomas Robertazzi	2006	For contributions to parallel processor scheduling. 
Gordon Roberts	2004	For contributions to the design and test of analog and mixed-signal integrated circuits, and education 
John Robertson	2013	For contributions to the understanding of high-k dielectrics and metal gate electrodes for CMOS technology 
Frank Robey	2017	For leadership in development of advanced radar systems 
Kelly Robinson	2011	For contributions to electrostatic performance of manufacturing processes and imaging devices 
Charles Robinson	1991	For leadership in the field of rehabilitation engineering research and development. 
Jorge Rocca	2000	For the development of plasma excited lasers and the table-top soft x-ray laser. 
Paolo Rocca	2023	For contributions to clustered and time-modulated antenna arrays 
Miguel Raul Rodrigues	2023	For contributions to multimodal data processing and foundations of reliable and secure communications 
Joel Rodrigues	2020	For contributions to Internet of Things and vehicular communications 
Jose Rodriguez	2011	For the development of new topologies and control methods for power electronic converters and drives 
Juan Rodriguez	1992	For technical leadership in the development of computer data storage devices. 
Pablo Rodriguez	2016	For contributions to the design and development of content distribution architectures in the Internet 
Pedro Rodriguez	2014	For contributions to the control of distributed power generation 
Juan Rodriguez-Andina	2023	For contributions to embedded systems in industrial electronics 
A Rodriguez-Vazquez	1996	For contributions to the design and applications of analog/digital nonlinear ICs 
Esther Rodriguez-Villegas	2024	For contributions to low power biomedical circuits and systems for wearable medical applications 
Mark Rodwell	2003	For contributions to high speed electron devices and integrated circuits. 
Antoine Roederer	1996	For contributions in the field of arrays and multibeam reflector antennas. 
Ajeet Rohatgi	1991	For theoretical and experimental contributions to the design and fabrication of high-efficiency solar cells. 
Ulrich Rohde	2002	For contributions to and leadership in the development and industrial implementation of microwave computer-aided design technology. 
Hermann Rohling	2006	For contributions to automotive radar. 
Robert Rohling	2019	For contributions to ultrasound for medical diagnosis and intervention 
Ronald Rohrer	1980	For theoretical contributions and practical software for computer-aided circuit design. 
Roberto Rojas	2001	For contributions to the understanding of high frequency electromagnetic radiation and scattering. 
Jon Rokne	2013	For contributions to computer graphics and geographic information systems 
Yves Rolain	2006	For contributions to measurement and modeling of nonlinear microwave devices. 
Fabio Roli	2012	For contributions to multiple classifier systems 
Arturo Roman-Messina	2012	For contributions to analysis of electric power system 
Hans Rombach	2003	For contributions to experimental software engineering. 
Justin Romberg	2018	For contributions to compressive sensing 
Jordi Romeu Robert	2012	For contributions to the development of fractal antennas 
Haisheng Rong	2022	For contributions to silicon photonics devices 
Bryan Root	2021	For leadership in improving semiconductor reliability test methods 
David Root	2002	For contributions to nonlinear modeling of active semiconductor devices. 
Michael Ropp	2024	For contributions to distributed energy resources integration in power systems 
Christopher Rose	2007	For contributions to wireless communication systems theory 
Jonathan Rose	2009	For contributions to field-programmable gate arrays 
Richard Rose	2013	For contributions in acoustic modeling of automatic speech and speaker recognition 
Kenneth Rose	2003	For contributions to information-theoretic methods in signal processing. 
Paul Rosen	2011	For contributions to Earth and planetary radar remote sensing 
Elyse Rosenbaum	2011	For contributions to electrostatic discharge reliability of integrated circuits 
Arnold Rosenberg	1997	For fundamental contributions to theoretical aspects of computer science and engineering. 
Catherine Rosenberg	2011	For contributions to resource management in wireless and satellite networks 
A Rosenberg	1984	For contributions to speech and speaker recognition. 
Luke Rosenberg	2024	For contributions to maritime radars 
David Rosenblum	2006	For contributions to scalable, distributed component- and event-based software systems. 
Larry Rosenblum	2024	For leadership in developing mobile augmented reality and visualization, and in visual analytics 
Philip Rosenkranz	1997	For contributions to the spectroscopy of oxygen and water vapor and to microwave radiometric remote sensing. 
Joachim Rosenthal	2019	For contributions to algebraic coding theory and cryptography 
Tajana Rosing	2018	For contributions to power and reliability management of Systems-on-Chip 
Mark Rosker	2012	For leadership in microwave and millimeter-wave phased arrays, gallium nitride semiconductors, and terahertz electronics 
Caroline Ross	2013	For contributions to synthesis and characterization of nanoscale structures and films for magnetic and magneto-optical devices 
Lucio Rossi	2013	For leadership in developing magnetic systems for the Large Hadron Collider 
Thomas Rossing	2005	For contributions to engineering education, acoustics and magnetic devices. 
Joseph Rostron	2024	For leadership in power switching interrupter design and development of circuit breakers and switchers 
Grigore Rosu	2021	For contributions to runtime verification and programming language semantics 
Mario Rotea	2007	For contributions to robust and optimal control of multivariable systems 
Eric Rotenberg	2015	For contributions to the microarchitecture of high-performance and reliable microprocessors 
Ron Roth	2003	For contributions to algebraic and modulation coding. 
Edward Rothwell	2005	For contributions to the development of radar target identification, discrimination, and detection schemes. 
Helmut Rott	2009	For contributions to microwave techniques for evaluating climate change 
Matthew Roughan	2019	For contributions to Internet measurement and analysis 
Stergios Roumeliotis	2016	For contributions to visual-inertial navigation and cooperative localization 
William Rouse	1985	For contributions to understanding and modeling human decision making and problem solving in engineering systems. 
George Rouskas	2012	For contributions in algorithms, protocols, and architectures of optical networks 
Christian Roux	2005	For contribution to the theory of functional shapesand its applications in medical imaging. 
Riccardo Rovatti	2012	For contributions to nonlinear and statistical signal processing applied to electronic systems 
Diane Rover	2016	For contributions to active learning methods in engineering education 
Chris Rowen	2016	For leadership in the development of microprocessors and reduced instruction set computers 
James Rowland	1995	For leadership in electrical engineering education. 
Simon Rowland	2014	For contributions to the application of polymers in high voltage systems 
Kaushik Roy	2002	For contributions to the power-aware design of digital circuits. 
Sumit Roy	2007	For contributions to multi-user communications theory and cross-layer design of wireless networking standards 
Romit Roy Choudhury	2019	For contributions to wireless network protocols and indoor localization 
Amit Roy-Chowdhury	2019	For contributions to video-based tracking and behavior analysis 
Badrinath Roysam	2018	For contributions to image processing algorithms for biological microscopy 
Yuriy Rozanov	2011	For contributions to electrical power engineering education 
Xinbo Ruan	2016	For contributions to switching-mode power converter topologies and modulation strategies 
Ahmed Rubaai	2015	For contributions to the development of high-performance controls for motor drives 
Izhak Rubin	1987	For contributions to the analysis and design of computer communication systems and networks, and to engineering education. 
Marcos Rubinstein	2014	For contributions to modeling lightning and its electromagnetic effects 
Rich Ruby	2010	For contributions to film bulk acoustic resonators, filters, and duplexers for mobile phones 
Massimo Rudan	2008	For contributions to theory and modeling of current transport in semiconductor devices 
Imre Rudas	2002	For contributions to the theory and applications of computational intelligence for the control of electro-mechanical and robotic systems. 
Karen Rudie	2018	For contributions to the supervisory control theory of discrete event systems 
Harry Rudin	1983	For contributions to the analysis of computer communication network performance and protocols. 
Hugh Rudnick	2000	For contributions to electric power sector deregulation in Latin America. 
Daniel Rueckert	2016	For contributions to biomedical image computing 
Albert Ruehli	1984	For key contributions to the field of computer-aided design. 
C Ruf	2001	For contributions in the development, calibration, and remote sensing applications of microwave radiometers. 
Alfred Rufer	2006	For contributions to supercapacitive energy storage techniques and asymmetrical multilevel inverters. 
Marina Ruggieri	2014	For contributions to millimeter-wave satellite communications 
Wilson Rugh	1997	For contributions to the theory of nonlinear systems and control. 
W Rummler	1989	For contributions to the modeling of multipath fading and its effect on microwave digital radio. 
Thomas Runkler	2022	For contributions to computational intelligence in clustering and control 
Daniela Rus	2010	For contributions to distributed and modular robotics 
Leslie Rusch	2010	For contributions in optical and wireless communications systems 
Charles M Rush	1990	For leadership and technical contributions to telecommunications programs in high-frequency broadcasting and target location, and to radio propagation analysis and modeling. 
Stephen Russek	2024	For contributions to metrology of spintronic devices and standardization of magnetic resonance imaging 
Don Russell	1991	For the development of high-impedance fault detection techniques using digital methods. 
Peter Russer	1994	For fundamental contributions to noise analysis and low-noise optimization of linear electronic circuits with  general topology. 
Leszek Rutkowski	2005	For contributions to neurocomputing and flexible fuzzy systems. 
David Rutledge	1993	For leadership in the theory, development, and application of integrated antennas in the millimeter-wave and terahertz regimes. 
Jerzy Ruzyllo	2004	For contributions to ultrathin oxidation in microelectronic manufacturing. 
Thomas Ryan	2011	For contributions to channel coding for reliable data transmission and storage 
Carl Ryan	1985	For contributions to the deign and prototyping of very high data-rate communications systems and wide-band signal processing electronics. 
Roland Ryf	2019	For contributions to optical switching and multiplexing technology 
Heiner Ryssel	1999	For introduction of ion implantation technology into the German Semiconductor Industry. 
Sei-Hyung Ryu	2023	For contributions to silicon carbide power device technology 
Victor Ryzhii	2004	For contributions to the development of quantum well infrared photodetectors and quantum dot infrared photodetectors. 
Theodore Rzeszewski	1994	"For contributions to the design and development of frequency-synthesized tuning, and of ""flesh tone"" correction for television receivers, and of high-definition television systems. "
AHMAD SAFARI	2005	For contributions to the development of piezoelectric tranducers. 
SAFIEDDIN SAFAVI-NAEINI	2015	For contributions to gigahertz to terahertz integrated antenna systems 
DAN SCHONFELD	2010	For contributions to image and video analysis 
SIRISH SHAH	2020	For contributions to process and performance monitoring 
ATIF SHAMIM	2024	For contributions in the field of antenna-on-chip and antenna-in-package 
ANDREI SHKEL	2014	For contributions to micromachined gyroscopes 
PETER SIEGEL	2001	For contributions to the field of millimeter and submillimeter-wave radiometry, technology and spaceborne instruments. 
JOHN SMITH	2007	For contributions to multimedia content analysis, retrieval and adaptation 
PAVLOS SOTIRIADIS	2023	For contributions to advanced frequency synthesis and high-speed data buses 
DANAIL STOYANOV	2024	For contributions to intelligent computer-assisted surgical and diagnostical systems 
HONG-BO SUN	2018	For contributions to laser nanofabrication and ultrafast spectroscopy 
S Michael Saad	1997	For contributions to the analysis, design and development of waveguide components. 
Ali Saberi	1998	For contributions to singular perturbation theory and nonlinear control. 
Rajiv Sabherwal	2019	For contributions to research on management of knowledge and information technologies 
Daniel Sabin	2016	For leadership in power quality database management and analysis software 
Krishan Sabnani	1991	For contributions to research and development in communications protocols. 
Alain Sabot	2006	For contributions to high voltage gas insulated substations and transmission lines. 
Manoj Sachdev	2012	For contributions to test methodology for very large scale integrated circuits 
M Sachdev	1983	For contributions to computer applications for power system analysis and protection. 
Edward Sacher	1997	For contributions to the relationship between molecular structure and dielectric properties. 
Edgar Sack	1968	For contributions to control systems and pattern recognition, and for his vigorous leadership in the integrated circuit field. 
P Sadayappan	2015	For contributions to parallel programming tools for high-performance computing 
Brian Sadler	2007	For contributions to signal processing and sensor networks 
Maryam Saeedifard	2022	For contributions to modulation, control and protection of multilevel converters for high-voltage DC transmission 
M Safiuddin	1993	For contributions to advanced industrial control systems for processes and electric drives, and for leadership in continuing education. 
Michael Safonov	1989	For contributions to the theory of robust multivariable control. 
Robert Safranek	2015	For contributions to perceptual image and video compression and quality 
Tapan Saha	2019	For contributions to monitoring and assessment of power transformers 
