Fellow	Year	Citation
Jean-P Leburton	1996	For contributions to nonlinear electronic transport and size quantization in semiconductor quantum wells, quantum wires, and quantum dots, and the theory of the index of refraction in superlattices. 
Roger Lecomte	2024	For contributions to avalanche photodiode use in scintillation detectors and to positron emission tomography 
Paul Lecoq	2015	For contributions to scintillator detectors for high-energy physics and medical imaging 
Ellsworth Ledrew	2006	For contributions to environmental remote sensing sciences. 
Gerard Ledwich	2020	For development of control of power systems and power electronics 
Kang-Won Lee	2022	For contribution to development of SDN and virtualization technologies for 5G wireless networks 
Byeong Lee	1997	For contributions to digital transform and filtering, to broadband telecommunications, and to digital scrambling. 
Insup Lee	2001	For contributions to the specification languages and verification tools for real-time systems. 
Edward Lee	1994	For contributions to design methodologies and programming techniques for real-time digital signal processing systems. 
Byoungho Lee	2014	For contributions to diffractive optics and three-dimensional display technologies 
Robert Lee	2008	For contributions to finite element and finite difference methods in electromagnetics 
Elhang Lee	2003	For contributions to optical devices for communication. 
Sanghoon Lee	2000	For contributions to ATM technology, broadband networks, and to the opening of packet video field. 
Jae Hong Lee	2011	For contributions to high-speed wireless communication systems 
Hua Lee	1992	For contributions high high-resolution imaging techniques and tomographic acoustic microscopy. 
Chin-Hui Lee	1997	For contributions to automatic speech and speaker recognition. 
Seung Jae Lee	2019	For contributions to power distribution protection and automation 
Sukhan Lee	1998	For contributions to human-machine systems and intelligent robots through development of teleoperator control systems and neural networks. 
Kwang Bok Lee	2011	For contributions to wireless communication systems 
Jujang Lee	2008	For contributions to intelligent robust control and robotics 
David Lee	1997	For contributions to theory and industrial applications of the design and testing of communication protocols. 
Kok-Meng Lee	2005	For contributions to actuator and vision-based sensor design for manufacturing automation. 
Dong-Choon Lee	2024	For contributions to energy conversion technology and systems 
Kevin Lee	2020	For contributions to power quality for adjustable speed drives 
Jay Lee	2011	For contributions to model-based predictive control applications 
Chang-Hee Lee	2010	For contributions to wavelength division multiplexed-passive optical network 
Jin Fa Lee	2005	For contributions to computational electromagnetics. 
Jack Lee	2002	For contributions to the understanding and development of ultra-thin dielectrics and their application to silicon devices 
Wei-Jen Lee	2007	For contributions to engineering education and power system analysis 
Kuen-Jong Lee	2017	For contributions to low-cost testing of digital VLSI circuits 
Beom Lee	2005	For contributions to the design and analysis of multiple robot systems. 
Yong Lee	2008	For contributions to photonic devices based upon vertical cavity surface emitting lasers and photonic crystals 
Inkyu Lee	2016	For contributions to multiple antenna systems for wireless communications 
Seong-Whan Lee	2010	For contributions to pattern recognition for biometrics and document image analysis 
Tsu-Tian Lee	1997	For contributions to the analysis and control of walking robots and leadership in robotics engineering education. 
Thomas Lee	2015	For contributions to the design of CMOS radio-frequency integrated circuits 
Jong-Sen Lee	1997	For contributions information processing applications of SAR and Polarimetric SAR Imagery. 
Kang Lee	2003	For contributions to smart sensor interfaces, networking, and standards. 
Kwang Lee	2001	For contributions to the development and implementation of intelligent system techniques for power plants and power systems control. 
Paul Lee	2015	For contributions to the development of CMOS image sensor technology and the pinned photo-diode active pixel sensor 
C.S. George Lee	1993	For contributions to computational algorithms and architectures in robot kinematics and dynamics, and for leadership in robotics education. 
Fred Lee	1990	For contributions to high-frequency quasi-resonant and multiresonant converters and for the development of a program of engineering education in power electronics. 
Lin-Nan Lee	1992	For contributions to applying coding theory, cryptography, and digital signal processing to commercial satellite communications. 
J Lee	2004	For contributions to wide band array antennas for radars and communication systems. 
Kai Fong Lee	1997	For contributions to microstrip antenna development and to electrical engineering education. 
Chin Lee	2001	For pioneering research in fluxless bonding technology and contributions to thermal design tools for electronic devices and packages. 
Der Tsai Lee	1992	For contributions to computational geometry and design and analysis of algorithms. 
Raphael Lee	2006	For contributions to biophysics of cellular and tissue injury by electric currents and development of polymers for repair of cellular damage. 
Ruby Lee	2003	For contributions to general-purpose processor architectures. 
Tony Lee	2005	For contributions to high-speed scalable packet switching technology for broadband telecommunications networks.. 
Ta Sung Lee	2016	For leadership and contributions in communication systems and signal processing 
Jong-Ho Lee	2016	For contributions to development and characterization of bulk multiple-gate field effect transistors 
Byoung Kuk Lee	2024	For contributions to battery chargers for electric vehicles 
Te-Won Lee	2011	For contributions to independent component analysis algorithms 
Shi-Wei Lee	2008	For contributions to solder joint reliability and the development of three dimensional packaging technologies 
Kyoung Mu Lee	2021	For contributions to image restoration and visual tracking 
Jaejin Lee	2019	For contributions to programming systems of heterogeneous machines 
Hsien-Hsin Lee	2017	For contributions to 3D integrated circuits and computer architecture 
Sang Bin Lee	2017	For contributions to off-line testing and on-line condition monitoring for ac electric machines 
Wenke Lee	2021	For contributions to machine-learning-based approaches to intrusion and botnet detection 
Wonjun Lee	2021	For contributions to multiple access and resource allocation in wireless networks 
Jungwon Lee	2018	For contributions to signal processing for cellular modems 
Ning-Cheng Lee	2017	For leadership in Surface Mount Technology and interconnect materials 
Daniel Lee	2014	For contributions to machine learning algorithms for perception and motor control 
Juho Lee	2019	For leadership in standardization of cellular communication technologies 
Wim Leemans	2007	For contributions to the field of advanced accelerators, in particular laser-plasma acceleration of electrons 
D M W Leenaerts	2005	For contributions to nonlinear circuit theory and design. 
David Leeson	1988	For contributions to the theory and practice of stable microwave signal sources for communication and radar. 
Frank Leferink	2019	For leadership in electromagnetic compatibility measurement techniques 
Russell Lefevre	2004	For leadership and contributions to civil applications of radar technology. 
James Leger	2003	For the development and application of diffractive and microoptical components. 
Robert Leheny	1991	For contributions to the integrated of optical and electronic devices exploiting the advantages of InP materials for telecommunications applications. 
Bradley Lehman	2020	For contributions to high quality LED lighting and modeling and control of DC-DC converters 
James Lehnert	2000	For contributions to the theory and practice of spread-spectrum multiple-access communication systems. 
Jane Lehr	2008	For contributions to high power switches for generating electromagnetic radiation 
Shaw-Min Lei	2006	For contributions to video and image coding standards. 
Hui Lei	2016	For contributions to scalable and dependable data access in  distributed computing systems 
Zhen Lei	2024	For contributions to face analysis and object detection 
Chris Leighton	2020	For contributions to the understanding of magnetic oxides, interfaces, and nanostructures 
Charles Leiserson	2016	For leadership in parallel and distributed computing 
Armando Leite Da Silva	2000	For contributions to the applications of probabilistic models to electric power systems planning and operations and to power engineering education. 
Will Leland	2003	For contributions to the characterization of traffic on data networks. 
Zachary Lemnios	2014	For leadership in advanced technologies of defense security systems 
A Lempel	1982	For contributions to the theory of data complexity, the practice of data compression, and the algebraic analysis and synthesis of digital sequences. 
Patrick Lenahan	2010	For contributions to understanding of radiation damage and reliabilityof metal-oxide semiconductor devices 
George Lendaris	1983	For conceiving, developing and implementing the use of sampled optical diffraction patterns for image analysis. 
Dennis Lenk	1999	For contributions to the design, manufacture, and application of high voltage surge arresters. 
Bengt Lennartson	2017	For contributions to hybrid and discrete event systems for automation and sustainable production 
Harry Lenzing	1994	For contributions to improvement of microwave line-of-sight communications links. 
Benjamin Leon	1970	For contributions to circuit theory and engineering education 
Jose Leon	2017	For contributions to high-power electronic converters 
Alberto Leon-Garcia	1999	For contributions to multiplexing and switching of integrated services traffic. 
Riccardo Leonardi	2018	For contributions to image and video compression and multimedia semantic content analysis 
Fred Leonberger	1985	For contributions to guided-wave optics. 
Raymond Leopold	1997	For leadership and contributions to world-wide satellite communications and personal wireless 
Jerzy Lepecki	1985	For leadership in development of electric-power research in Brazil. 
Martin Lepselter	1972	For contributions to the advancement of transistor and integrated circuit arts 
Bruno Lequesne	1997	For contributions to the development of electromechanical actuators for automotive applications. 
Jean-Luc Leray	2004	For contributions to the implementation of radiation hardened silicon-on-sapphire and silicon-on-insulator technologies. 
Bernard Lesieutre	2023	For contributions to electric power system dynamic modeling, simulation and power engineering education 
George Lester	1983	For contributions to the standardization, design, and application of high-voltage power circuit breakers and to the understanding of transient switching of capacitor banks. 
Khaled Letaief	2003	For contributions to the analysis, design, and performance evaluation of high-speed wireless communication systems 
Kin Leung	2001	For contributions to performance analysis, protocol design, and control algorithms for communications networks. 
Kwok Wa Leung	2011	For contributions to the development of the dielectric resonator antenna 
Victor Leung	2003	For contributions to the design of protocols and management strategies for wireless and mobile communication networks. 
Henry Leung	2015	For contributions to chaotic communications and nonlinear signal processing 
Wu-Hon Leung	1998	For contributions to operating systems, protocols and programming methods supporting the development of distributed systems and multimedia communication applications. 
Geert Leus	2012	For contributions to signal processing for communications 
Juerg Leuthold	2013	For contributions to high-speed optical communications 
Hanoch Lev-Ari	2005	For contributions to adaptive filtering and structured estimation for non-stationary signals. 
Nadav Levanon	1998	For contributions to radar signal analysis and detection. 
Marc Levenson	1989	For contributions to nonlinear quantum optics, photolithography, and nonlinear laser spectroscopy. 
Emil Levi	2009	For contribution to vector control of induction motor drives 
Yehuda Leviatan	1998	For contributions to the developments of new computational techniques for electromagnetic scattering analysis. 
William Levine	1986	For application of control theory to controller design, traffic control and neurophysological controls. 
Alexander Levis	1987	For application of system and control theory to complex decision-making processes 
Lev Levitin	1994	For contributions to physical information theory and quantum communication systems. 
Baruch Levush	2001	For leadership in the development of theoretical and computational models of free electron radiation sources. 
Moises Levy	1995	For contributions to the characterization of superconducting and magnetic materials by ultrasonic techniques. 
Bernard Levy	1994	For contributions to the modeling and estimation of multidimensional random processes. 
Tom Lewellen	2008	For contributions to nuclear medicine and positron emission tomography imaging systems 
Peter Lewin	1993	For contributions to the fields of electroacoustics and medical ultrasonics and for the development of new transducers and measurement methods. 
Paul Lewin	2013	For contributions to high voltage cable engineering 
Frank Lewis	1994	For contributions to descriptor systems and to control system education. 
Peter Lewis	1987	For leadership in the research, testing, and development of utility battery energy storage technologies. 
E Lewis	1976	For contributions to the modeling of neurological processes and the understanding of neurological transducers. 
Alan Lewis	1996	For contributions to advanced complimentary metal oxide semiconductor devices physics and circuit design for large area microelectronics and very large scale integrated. 
Laura Lewis	2023	For contributions to the design of magneto-functional materials 
Ming-Jun Li	2015	For contributions to optical fiber technology 
Jin Li	2012	For contributions to multimedia delivery, compression and storage for real-time communication 
Victor Li	1992	For contributions to the design and analysis of communications networks. 
Wenyuan Li	2002	For contributions to power system reliability theory, calculation methods and algorithms, and applications. 
Keqin Li	2015	For contributions to parallel and distributed computing 
Ching C Li	1978	For contributions to biocybernetics. 
Xiaorong Li	2004	For contributions to the theory and practice of radar development. 
Bo Li	2011	For contributions to content distribution via the internet 
Pai-Chi Li	2008	For contributions to ultrasonic imaging technologies 
Weiping Li	2000	For contributions to image and video coding algorithms, standards, and implementations. 
Er Li	2008	For contributions to electromagnetic modeling and simulation in high speed electronics 
Youfu Li	2022	For contributions to active visual sensing using structured light pattern projection 
Haizhou Li	2014	For leadership in multilingual speaker and language recognition 
Stan Li	2009	For contributions to face recognition, pattern recognition and computer vision 
Ye Li	2006	For contributions to signal processing for wireless communications. 
Chung Li	2003	For contributions to digital libraries and universal multimedia access. 
Jian Li	2005	For contributions to adaptive beam forming, radar imaging, and target detection. 
Ping Li	2010	For contributions to iterative signal processing, multi-user detection and concatenated error control codes 
Kai Li	2011	For contributions to distributed shared memory, cluster communication, and deduplication storage systems 
Han-Xiong Li	2011	For contributions to distributed shared memory, cluster communication, and deduplication storage systems 
Guifang Li	2013	For contributions to all-optical signal processing and high-capacity fiber-optic transmission 
Jie Li	2024	For contributions to performance and management of network systems 
Junyi Li	2012	For contributions to modulation techinques for mobile broadband communications systems 
Hui Li	2018	For contributions to bidirectional converters for utility applications and high efficiency PV converters 
Xin Li	2017	For contributions to image coding, restoration, and interpolation 
Jingshan Li	2017	For contributions to manufacturing system automation 
Hongbin Li	2019	For contributions to adaptive radar signal processing with limited data 
Ninghui Li	2021	For contributions to data privacy and security 
Mike-Peng Li	2012	For contributions to the design of jitter test technologies 
Xiangyang Li	2015	For contributions to performance analysis and resource allocation in wireless networks 
Baochun Li	2015	For contributions to application-layer network protocols and network coding 
Jonathan Li	2023	For contribution to point cloud analytics in LiDAR remote sensing 
Ming Li	2007	For contributions in kolmogorov complexity and its applications 
Xin Li	2017	For contributions to modeling, analysis, and optimization of variability of integrated circuits and systems 
Peng Li	2016	For contributions to the analysis and modeling of integrated circuits and systems 
Zhuo Li	2018	For contributions to physical synthesis and modeling of integrated circuits 
Yun Wei Li	2020	For contributions to power electronics converters in microgrids and industrial drives 
Xiaodong Li	2020	For contributions to large-scale and particle swarm optimization 
Yonghui Li	2019	For contributions to cooperative communications technologies 
Keqiu Li	2022	For contributions to resource-efficient and QoS-oriented cloud computing 
Shaoqian Li	2016	For leadership in development of broadband wireless networks 
Li Li	2017	For contributions to intelligent transportation systems and vehicles 
Minglu Li	2023	For contributions to wireless sensor and vehicular networks 
Feifei Li	2022	For contributions to database query processing and optimization, and to cloud database systems 
Zhiwu Li	2016	For contributions to Petri nets and their applications to automated manufacturing systems 
Yuanqing Li	2017	For contributions to brain signal analysis and brain computer interfaces 
Xiuling Li	2017	For contributions to semiconductor nanomaterials for electronic and photonic applications 
Shihua Li	2020	For contributions to the theory of mismatched disturbance rejection in industrial systems 
Xiaofeng Li	2020	For contributions to the application of synthetic aperture radar for ocean remote sensing 
Shutao Li	2019	For contributions to image fusion and classification in remote sensing 
Zhijun Li	2022	For contributions to control systems for wearable robotics and bio-mechatronics 
Hai Li	2019	For contributions to neuromorphic computing systems 
Ming Li	2024	For contributions to information and network security 
Li Li	2013	For contributions to the design of algorithms and protocols for wireless networks 
Jun Li	2021	For contributions in hyperspectral image processing 
Hang Li	2017	For contributions to machine learning for information retrieval and natural language processing 
Jia Li	2023	For leadership in large-scale AI 
Houqiang Li	2021	For contributions to video coding and multimedia content analysis 
Guoliang Li	2023	For contributions to human-in-the-loop data management and database systems 
Zong-Ming Li	2023	For contributions to carpal tunnel biomechanics and neuromuscular hand motor control 
Jiao Li-Cheng	2018	For contributions to artificial neural networks and evolutionary computation 
Ben Liang	2018	For contributions to mobility modeling and resource management in wireless networks 
Tsorng-Juu Liang	2016	For contributions to power conversion for lighting and sustainable energy 
Zhi-Pei Liang	2006	For contributions to biomedical applications of magnetic resonance imaging. 
Jerome Liang	2007	For contributions to medical image reconstruction and virtual colonoscopy 
Shunlin Liang	2013	For contributions to remote sensing from satellite observations 
Ying-Chang Liang	2011	For contributions to cognitive radio communications 
Qilian Liang	2017	For contributions to interval type-2 fuzzy logic systems 
Jun Liang	2024	For contributions to DC gridâs modeling and control 
Di Liang	2024	For contributions to photonic integration in optical communication, computing, and volume production 
Paul Liao	1987	For contributions to nonlinear optics and laser spectroscopy. 
Wanjiun Liao	2010	For contributions to communication protocols in multimedia networking 
Xiaofeng Liao	2021	For contributions to neurodynamic systems and chaotic cryptography 
James Libous	2013	For contributions to switching noise minimization in CMOS technology 
Daniel Lidar	2015	For contributions to quantum information processing 
Donald Lie	2017	For contributions to high linearity and high efficiency silicon RF power amplifiers for broadband wireless applications 
Jorg Liebeherr	2008	For contributions to the design and analysis of computer networks and their protocols 
Michael Lieberman	1994	For contributions to research in plasma-assisted materials processing, nonlinear dynamics, and controlled fusion. 
Erik Lier	2005	For contributions to dielectric-loaded feed horns and phased array antennas. 
Michael Lightner	1998	For contributions to the Computer-Aided Design of Integrated Circuits 
Leo Ligthart	2002	For contributions to antenna research and radar technology. 
K. Likharev	2009	For contributions to superconducting digital electronics and single-electron tunneling devices 
Jae Lim	1986	For contributions to speech and image enhancement and digital signal processing. 
Yong-Ching Lim	2000	For contributions to the design of FIR digital filters. 
Teng-Joon Lim	2017	For contributions to statistical signal processing in wireless communications 
Christina Lim	2023	For contributions in hybrid fiber-wireless communications technology 
Sung Kyu Lim	2023	For contributions to electronic design automation and tradeoff for 3-dimensional integrated circuits 
John Limb	1978	For contributions to efficient coding of color and monochrome video signals. 
David Limebeer	1992	For contributions to multivariable systems theory. 
Lih-Yuan Lin	2010	For contributions to optical micro-electro-mechanical systems switching technologies 
Faa-Jeng Lin	2017	For contributions to intelligent control systems for motor drives and motion control 
P Lin	1981	For contributions to computer-aided analysis and applications of graph theory circuits and systems. 
James Lin	1986	For contributions to understanding the biological effects of pulsed microwave  in the inner ear of human. 
Feng Lin	2009	For contributions to the theory and application of discrete event systems 
Chin Teng Lin	2005	For contributions to biologically inspired information Systems. 
Ching Fuh Lin	2010	For contributions to broadband semiconductor optical devices 
Zongli Lin	2007	For contributions to linear and nonlinear control theory 
Weisi Lin	2016	For contributions to perceptual modeling and processing of visual signals 
S Lin	1980	For contributions to coding theory and engineering education. 
Chih-Jen Lin	2011	For contributions to support vector machine algorithms and software 
Jenshan Lin	2010	For contributions to integrated microwave circuits and systems for wireless sensors 
Wei Lin	2018	For contributions to nonlinear control systems 
Wallace Lin	2020	For contributions to understanding transistor charging mechanisms 
Gong-Ru Lin	2020	For contributions to ultrafast fiber lasers and highspeed laser diodes for optical communications 
Chih-Min Lin	2010	For contributions to fuzzy system, neural network, and cerebellar model articulation controllers 
Burn Lin	2003	For contributions to lithography theory, tooling, masks, and fabrication technology. 
Chinlon Lin	1991	For contributions leading to the first experimental demonstration of dispersion-shifted single-mode fiber waveguides for high-speed long-distance optical communications. 
Kwei-Jay Lin	2010	For contributions to imprecise computations for scheduling real-time systems 
Chia-Wen Lin	2018	For contributions to multimedia coding and editing 
Ying-Dar Lin	2013	For contributions to multi-hop cellular communications and deep packet inspection 
Jason Yi-Bing Lin	2003	For contributions to the design and modeling of mobile telecommunications networks and leadership in personal communications services education. 
Ching-Yung Lin	2012	For contributions to network science and multimedia security and retrieval 
Kwang-Lung Lin	2011	For contributions to development of lead-free solder alloys and material interactions 
Zhouchen Lin	2018	For contributions to low-rank data modeling and image processing 
Xiaojun Lin	2017	For contributions to scheduling and control of wireless networks 
Phone Lin	2017	For contributions to resource management and service development for mobile networks 
Zhiyun Lin	2024	For contributions to distributed multi-agent systems and autonomous systems 
Liang Lin	2024	For contributions to multimedia content analysis 
Xuemin Lin	2016	For contributions to algorithmic paradigms for database technology 
Bernabe Linares-Barranco	2010	For contributions to the design and application of linear and nonlinear circuits in neuromorphic systems 
Sture Lindahl	2002	For contributions to advanced solutions for power system analysis, design, planning and operation. 
