Fellow	Year	Citation
Dr. FAZAL ALI	1999	For contributions to the design and development of monolithic microwave integrated circuits (MMICs) and providing leadership in commercial applications of the same. 
LEOPOLDO ANGRISANI	2019	For contributions to test and measurement of communication systems 
Ronald Aarts	2007	For research and application in signal processing for acoustics and sound  reproduction 
Vasudev Aatre	2002	For leadership in research and development for strategic electronics and defense systems 
Behnaam Aazhang	1999	For contributions to multi-user wideband digital cellular communications. 
Magdy Abadir	2006	For contributions to the test and verification of microprocessors. 
Alessandro Abate	2024	For contributions to verification and control of stochastic hybrid systems 
Hussein Abbass	2020	For contributions to evolutionary learning and optimization 
Pieter Abbeel	2018	For contributions to apprenticeship and reinforcement learning for robotics and autonomous systems 
Derek Abbott	2005	For contributions to analysis of noise and stochastic phenomena in vision systems. 
M Abdel-Mottaleb	2011	For contributions to biometrics, content-based image and video retrieval, and digital mammography 
Ali Abdi	2019	For contributions to wireless channel modeling and underwater communications 
David Abe	2015	For leadership and contributions to the development of high power microwave and millimeter wave vacuum  electronic devices 
Eyad Abed	2002	For contributions to the control of nonlinear dynamical systems and singular perturbation methods. 
Karim Abed-Meraim	2019	For contributions to blind system identification and source separation for communications 
Harold Abelson	1995	For contributions to the use of computers in education. 
P Thushara Abhayapala	2024	For contribution to the theory of spherical harmonic-based spatial sound field recording, reproduction, and control 
Asad Abidi	1996	For contributions to the design of high-frequency MOS analog integrated circuits. 
Mohamed D Abouzahra	2011	For leadership in passive planar microwave components and in planar microwave circuits 
Jacob Abraham	1985	For contributions to the testing of large complex integrated circuits. 
Michael Abramoff	2020	For contributions to the application of artificial intelligence methods in diabetic retinopathy 
Yuri Abramovich	2009	For contributions to adaptive signal processing for detection and estimation in  radar arrays 
Miron Abramovici	1993	For contributions to fault simulation and automatic test generation algorithms for VLSI circuits. 
Daniel Abramovitch	2022	For contributions to the development of algorithms for control of mechatronic systems 
Norman Abramson	1973	For contributions to engineering education, coding theory, pattern recognition, and computer networks. 
David Abramson	2016	For contributions to software tools for high performance, parallel, and distributed computing 
Patrice Abry	2012	For contributions to the theory and applications of fractal and multifractal analysis in signal and image processing 
Pamela Ann Abshire	2018	For contributions to CMOS biosensors 
Haithem Abu-Rub	2018	For contributions to power electronic converters for renewable energy applications 
Ali Abur	2003	For contributions to the methods for state estimation of power systems. 
Maurice Aburdene	1996	For significant and sustained contributions to the development of undergraduate electrical engineering laboratories and undergraduate education. 
Alejandro Acero	2004	For contributions to noise robust speech recognition and speech technology education. 
Enrique Acha	2021	For contributions to power electronics modelling and applications in electrical power systems 
Ramachandra Achar	2013	For contributions to interconnect and signal integrity analysis in high-speed designs 
Raj Acharya	2010	For contributions to biomedical imaging and bioinformatics 
Tinku Acharya	2010	For contributions to very large scale integration algorithms and architectures for electronic image processing 
Brice Achkir	2014	For contributions to diagnostics of physical layer design in gigabit digital transmission systems 
Behcet Acikmese	2022	For contributions to optimization-based nonlinear control and to planetary landing systems 
Edward Ackerman	2007	For contributions to the optimization of analog optical links 
Bryan Ackland	1992	For contributions to the design of custom integrated circuits for signal processing systems. 
Scott Acton	2013	For contributions to biomedical image analysis 
Fumiyuki Adachi	2002	For contributions and leadership in digital cellular communication technologies. 
Tulay Adali	2009	For contributions to nonlinear and complex-valued statistical signal processing 
John Adam	1991	For contributions to the development of microwave device applications of ferrite thin films. 
Kazimierz Adamiak	2009	For contributions to the numerical analysis of applied electrostatic and electrohydrodynamic processes 
Mark Adamiak	2005	For contributions to power system protection, communications protocols and standards for power system substations. 
Alfred Adams	2001	For contributions to the advancement of semiconductor quantum-well lasers by the incorporation of strain. 
Robert Adams	2012	For contributions to analog and digital signal processing 
Rambabu Adapa	2012	For leadership in DC and flexible AC transmission systems 
Edward Adelson	2019	For contributions to image representation and analysis in computer vision 
Ilesanmi Adesida	1999	For contributions to compound semiconductor devices and circuits. 
Michael Adler	1985	For contributions to CAD modeling of power semiconductor devices. 
Amr Adly	2011	For contributions to multi-component magnetic hysteresis models 
Claudio Adragna	2024	For contributions to industrial usage of resonant converters in offline power supplies 
Raviraj Adve	2017	For development of signal processing techniques for airborne radar 
Sarita Adve	2012	For contributions to shared memory semantics and parallel computing 
Anant Agarwal	2012	For contributions to silicon carbide power device technology 
G Agarwal	1986	For contributions to understanding and modeling of human motor system. 
Vivek Agarwal	2015	For contributions to topologies and control schemes for solar photovoltaic energy conversion and power quality enhancement 
Ramesh Agarwal	2003	For contributions to robust control of uncertain systems with applications to flight and flow control. 
Ramesh Agarwal	1987	For contributions to number-theoretic transforms and fast convolution algorithms in digital signal processing. 
Forrest Agee	2000	For leadership in and contributions to the engineering and physics of high power microwave, pulsed power, and ionizing radiation devices. 
Vassilios Agelidis	2016	For contributions to power electronics, renewable energy conversion and integration with electricity grid 
Tilak Agerwala	1986	For leadership in the development of very high performance computers. 
J Aggarwal	1976	For contributions to time delay systems and digital filters. 
Charu Aggarwal	2010	For contributions to knowledge discovery and data mining techniques 
Gul Agha	2002	For contributions to the theory and practice of concurrent programming. 
Amir Aghdam	2023	For research leadership in distributed control of large-scale interconnected systems 
Abdol-Hamid Aghvami	2005	For contribution to the advancement of multiple access protocols for mobile communications. 
Vishwani Agrawal	1986	For contributions to probabilistic testing techniques for large integrated circuits. 
Rakesh Agrawal	1999	For contributions to the theory and practice of database management. 
Govind Agrawal	1996	For contributions to the development and understanding of semiconductor lasers and fiber-optic communications systems. 
Bajarang Agrawal	1994	For contributions to the identification measurement, and control of subsynchronous resonance in power systems. 
Prathima Agrawal	1989	For contributions to computer-aided design and testing of integrated circuits. 
Dakshi Agrawal	2012	For contributions to theory, analysis, and design of efficient, secure, and privacy-preserving communication systems 
Ashok Agrawala	1991	For contributions to distributed algorithms and policies for computer systems 
Erik Agrell	2018	For contributions to coding and modulation in optical communications 
Syed Ahamed	1992	For contributions to the study and design of digital subscriber lines. 
M.Omair Ahmad	2001	For contributions to the design and implementation of digital signal processing algorithms. 
Ishfaq Ahmad	2008	For contributions to scheduling techniques in parallel and distributed computing systems 
Hamid Ahmadi	1996	For contributions to high speed ATM networking technology and to wireless networking. 
M Ahmadi	2002	For contributions to the design of digital filters, and to pattern recognition and image restoration. 
Nasir Ahmed	1985	For contributions to engineering education and to digital signal processing. 
Doyeol (David) Ahn	2005	For contributions to the theory of semiconductor quantum-well lasers and the development of quantum information communications research. 
Gail-Joon Ahn	2023	For development of applications of information and systems security 
Alfred Aho	1988	For contributions to programming language translation, to data structures and algorithms, and to data systems. 
Richard Ahrenkiel	2001	For contributions to measurement of minority carrier lifetimes in semiconductor materials 
Narendra Ahuja	1992	For contributions to three-dimensional computer vision. 
Bhupendra Ahuja	2006	For contributions to design of mixed signal complementary metal oxide semiconductor (CMOS) integrated circuits for telecommunications and computer communications systems. 
Bo Ai	2022	For contributions to channel modeling and wireless communications in high-speed railways 
Kenichi Aihara	1999	For contributions and leadership in multimedia networking technologies and their applications. 
Thomas Ainsworth	2014	For contributions to the interpretation and analysis of polarimetric SAR imagery 
Sonia Aissa	2019	For contributions to design and performance analysis of cognitive radio and cooperative communication systems 
Colin Aitchison	1994	For contributions to the design of microwave active circuits. 
JStewart Aitchison	2019	For contributions to nonlinear optical devices and point-of-care testing systems 
Robert Aitken	2013	For contributions to testing and diagnosis of integrated circuits 
Kiyoharu Aizawa	2016	For contributions to model-based coding and multimedia lifelogging 
Venkataramana Ajjarapu	2008	For contributions to power system voltage stability assessment and control methods 
Marco Ajmone Marsan	1999	For the development of generalized stochastic petri net theory and its applications. 
Hirofumi Akagi	1996	For contributions to the theory of instantaneous reactive power in three-phase circuits, and to the development of active power filters for harmonic compensation in power systems. 
Yoshihiko Akaiwa	2001	For contributions to digital modulation techniques and distributed dynamic channel assignment for mobile radio communications. 
Ozgur B Akan	2016	For contributions to wireless sensor networks 
Ali Akansu	2008	For contributions to optimal design of transforms and filter banks for communications and multimedia security 
Metin Akay	2009	For contributions to biomedical signal modeling and processing 
Maruthi Akella	2022	For contributions to spacecraft control systems 
Lex Akers	1997	For contributions to analog neural networks and to the modeling of microelectronic devices. 
Jaleel Akhtar	2023	For contributions in microwave planar sensors and nano-composites-based microwave absorbers 
Shigeyuki Akiba	2002	For contributions to infrared semiconductor lasers and to the development of high capacity transoceanic undersea cable systems. 
Bilal Akin	2023	For contributions to control, diagnosis and condition monitoring of AC drives 
Akintunde Akinwande	2008	For contributions to the development of digital self-aligned gate technology and vacuum microelectronic devices 
Deji Akinwande	2021	For contributions to wafer-scale graphene synthesis and application to flexible devices 
Shirabe Akita	2004	For contributions in applied superconductivity in support of electric power applications. 
Hidenori Akiyama	2000	For contributions to the development of pulsed power technology and its industrial applications. 
Kemal Akkaya	2023	For contributions to routing and topology management in wireless ad hoc and sensor networks 
Ian Akyildiz	1996	For contributions to performance analysis of computer communication networks. 
Kamal Al Haddad	2007	For contributions to research and development of power electronics converters 
Bashir Al-Hashimi	2009	For contributions to low power integrated circuits and  systems 
Ghassan AlRegib	2022	For contributions to perception-based and context-based visual signal processing 
Mohammad Alam	2014	For contributions to pattern recognition and high resolution image reconstruction 
Muhammad Alam	2006	For contributions to complementary metal oxide semiconductors (CMOS) circuit reliability and computational models for electronics and optoelectronics. 
Matteo Albani	2018	For contributions to the uniform geometrical theory of diffraction 
David Albonesi	2011	For contributions to power-efficient and adaptive computer architectures 
Alin Albu-Schaeffer	2016	For contributions to compliant and lightweight robots 
A Alcock	1989	For contributions to the investigation and development of excitation techniques for laser-produced plasmas. 
Fernando Aldana	1990	For contributions to industrial electronics 
M Dayne Aldridge	1991	For contributions to the design and application of electronic sensors and monitoring systems in the mining industry. 
Stephen Alexander	2013	For contributions to optical communication technologies, systems, and architectures 
Charles Alexander	1994	For leadership in the field of engineering education and the professional development of engineering students. 
Roy Alexander	2006	For contributions to technology for capacitor bank switching and the standardization of switchgear. 
Daniel Alexander	2024	For contributions to medical imaging and analysis 
A Alghunaim	1989	For leadership in international organizations to advance telecommunication development in Third World Countries 
Ahmed Ali	2021	For leadership in high-speed analog-to-digital converter design and calibration 
Mubarak Ali Shah	2003	For contributions to motion-based recognition and shape from shading in computer vision 
Walid Ali-Ahmad	2023	For leadership in development of low-cost direct-conversion cellular RF systems 
Massimo Alioto	2016	For contributions to energy-efficient VLSI circuits 
Cesare Alippi	2006	For contributions to robustness and application-level synthesis of embedded information processing systems. 
Paavo Alku	2020	For contributions to analysis, synthesis and quality improvement of speech signals 
Dennis Allan	1992	For contributions to the design and development of power transformers. 
Ronald Allan	1988	For contributions to the development of application of probability methods to power systems. 
Jan Allebach	1991	For contributions to the theory of sampling and reproduction of multidimensional signals. 
Jont Allen	1985	For contributions to speech analysis and synthesis systems 
Mark Allen	2011	For contributions to micro and nanofabrication technologies for microelectromechanical systems 
M Allen	1987	For contributions to the design and construction of radio frequency apparatus for high-energy storage rings and accelerators. 
James Allen	1977	For contributions to the characterization, analysis, and application of ferromagnetic materials in microwave devices. 
Phillip Allen	1992	For contributions to electrical engineering education and microelectronics textbooks. 
John Allen	2010	For contributions to high current radio frequency discharges, sheath and wave phenomena, and electronegative and dusty plasmas 
Andrew Alleyne	2018	For contributions to the control of thermal management systems 
David Allstot	1992	For contributions to the analysis and design of switched-capacitor and analog integrated circuits. 
Kevin Almeroth	2014	For contributions to multicast communication, wireless networks, and educational technology 
J Marcos Alonso	2022	For contributions to power electronics in lighting applications 
Gustavo Alonso	2014	For contributions to data management and distributed systems 
MohamedSlim Alouini	2009	For contributions to design and performance analysis of wireless communication systems 
Charles Alpert	2006	For contributions to physical design automation of very large scale integrated (VLSI) circuits. 
Gerard Alphonse	1998	For the practical development of single-mode, high-power, superluminescent diodes, with applications to fiber optic gyroscopes, optical amplifiers, spectroscopy, and low coherence interferometry. 
Ongun Alsac	1995	For contributions to efficient power flow analysis methods for large-scale power networks. 
Husam Alshareef	2024	For the development of nanoscale materials for device applications and their deployment in volume production 
Daniel Alspach	1998	For leadership in the theoretical development of non-linear estimation theory and its practical applications to multiple target data association and tracking problems in ocean surveillance. 
Eitan Altman	2010	For contributions to analysis, optimization, and control of telecommunication networks 
E Altshuler	1984	For contributions to the understanding of tropospheric effects on millimeter wave propagation. 
Hector Altuve	2015	For contributions to power line and transformer protection 
Andrea Alu	2014	For contributions to the theory and applications of electromagnetic metamaterials and plasmonic phenomena 
Rajeev Alur	2008	For contributions to automata, logics, and verification techniques for real-time and hybrid systems 
Srinivas Aluru	2010	For contributions to computational biology 
Fernando Alvarado	1993	For contributions to the understanding and utilization of sparse matrices in power system analysis. 
Alexandre Alves da Silva	2016	For contributions to dynamic security assessment and load forecasting in power systems 
Lorenzo Alvisi	2016	For contributions to reliable distributed systems 
Abeer A Alwan	2008	For contributions to speech perception and production modeling and their applications 
Markus Amann	2007	For contributions to laser diodes for optical communications and sensing 
Shun-Ichi Amari	1994	For contributions to mathematical foundations of neurocomputing and information geometry. 
Nancy Amato	2010	For contributions to the algorithmic foundations of motion planning in robotics and computational biology 
Anthony Ambler	1998	For contributions to economics of testing complex digital devices and systems. 
Aaron Ames	2021	For contributions to hybrid and safety-critical nonlinear control with demonstration on robotic systems 
Akihiro Ametani	1992	For contributions to the analysis of electrical transients in power systems. 
Daniel Amey	2008	For contributions to electronic packaging and high frequency characterization of ceramic system package materials 
Moeness Amin	2001	For contributions to time-frequency signal representations and their application. 
Massoud Amin	2016	For leadership in smart grids and security of critical infrastructures 
Amir Amini	2007	For contributions to cardiovascular imaging and medical image analysis 
Max Ammann	2019	For contributions to compact antennas for wideband wireless applications 
Mostafa Ammar	2002	For contributions to the design of scalable multimedia services and their network support. 
C Anagnostopoulos	1999	For contributions to Solid State Imagers and Integrated Circuits for Digital Cameras. 
P AnandaMohan	2005	For contributions to telecommunications technologies. 
Animashree Anandkumar	2021	For contributions to theory and applications in signal processing, machine learning, and artificial intelligence 
V Anantharam	1998	For contributions to the analysis and control of communication networks. 
Dimitris Anastassiou	1998	For contributions to video technology, developing high-performance digital image and video coding techniques. 
Yoshiharu Anbe	1998	For contributions to the research and development of automatic control system for metal rolling mills. 
Andre Anders	2001	For contributions to the physics and technology of cathodic arc plasmas. 
George Anders	1999	For contributions to probabilistic methods for power system analysis, and to power cable rating methods. 
Bjarne Andersen	2014	For leadership in High Voltage DC Transmission Systems, AC Power Electronics, and Reactive Power Compensation 
James Anderson	2012	For contributions to the implementation of soft-real-time systems on multiprocessor and multicore platforms 
Richard Anderson	1971	For contributions to semiconductors and to engineering education. 
L Anderson	1974	For contributions in the field of holographic optical memories. 
Robert Anderson	1993	For contributions to the continuing education of engineers and other professionals. 
Brian Anderson	1975	For contributions to quadratic optimal control and stability theory, and for leadership in electrical engineering education. 
W.Cleon Anderson	2008	For contributions to servo control systems 
John Anderson	1987	For contributions to tree coding and band-width-efficient modulation. 
Jason Anderson	2023	For contributions to high-level synthesis and low-power FPGAs 
C Andersson	1997	For contributions to the analysis of the interaction between AC and DC systems and of voltage stability in power systems. 
Yasuhiro Ando	2003	For contributions to optical connector technologies. 
Makoto Ando	2003	For contributions to the design of high gain planar waveguide arrays. 
Peter Andrekson	2006	For contributions to ultra-high-speed fiber-optic communication systems. 
Andreas Andreou	2006	For contributions to energy efficient sensory microsystems. 
A Andrews	2002	For technical leadership of government research and development programs 
James Andrews	1989	For contributions to picosecond-domain pulse techniques and measurements. 
Matthew Andrews	2015	For contributions to network design and wireless resource allocation 
Francesco Andriulli	2023	For contributions to computational electromagnetics 
Simon Ang	2011	For contributions to education power electronics and microelectronics in packaging education 
Lay-Kee Ang	2022	For contributions to electron emission and space charge effects in nanodiode and quantum materials 
Jorge Angeles	2006	For contributions to the kinematics, dynamics and design of robotic mechanical systems. 
David Angeli	2015	For contributions to nonlinear control theory 
Plamen Angelov	2016	For contributions to neuro-fuzzy and autonomous learning systems 
Jaume Anguera	2020	For contributions to small multiband antennas for wireless telecommunication devices 
Anuradha Annaswamy	2002	For contributions to adaptive control theory, neural networks, and active-adaptive control of combustion systems. 
Rashid Ansari	1999	For contributions to multirate digital signal processing and digital filter banks. 
Nirwan Ansari	2009	For contributions to broadband networks and communications 
Sameer Antani	2024	For contributions to medical imaging research in high-morbidity disease screening 
Yahia Antar	2000	For contributions to polarization studies, microstrip and dielectric resonator antennas. 
Philip Anthony	1999	For contributions to the development of electro-optic devices and lightwave communication systems. 
Gianluca Antonelli	2021	For contributions to modeling and control of underwater robots 
Dimitri Antoniadis	1990	For contributions to the fabrication process modeling and simulation and to field-effect quantum transport devices. 
Paul Antonik	2007	For contributions to knowledge-based radar systems 
Andreas Antoniou	1982	For contributions to active and digital filters, and to electrical engineering education. 
Grigoris Antoniou	2022	For contributions to knowledge representation within artificial intelligence and to the semantic web 
Panayotis Antsaklis	1991	For contributions to the theory of feedback stabilization and control of linear multivariable systems. 
Hideaki Aochi	2021	For contributions to three dimensional flash memories 
Tomonori Aoyama	2002	For contributions to digital signal processing for communications and broadband communication networks. 
John Apostolopoulos	2008	For contributions to the principles and practice of video communications and secure media streaming 
Alexander Apostolov	2009	For contributions to use of digital computers for power system protection, communication, and operation 
Joseph Appelbaum	1995	For contributions to solar conversion systems. 
Joerg Appenzeller	2010	For contributions to carbon nanotube transistors and circuits 
Thomas Aprille	1986	For contributions to the computer-aided analysis of nonlinear oscillatory networks and the design of communication circuits and systems. 
Shigehisa Arai	2010	For contributions to single-mode semiconductor lasers for optical communications 
Tatsuo Arai	2016	For contributions to micro manipulators and sensors, and applications to cellular biology 
Yasuhiko Arakawa	2006	For contributions to the understanding of quantum confinement effects in semiconductor lasers and the development of quantum dot lasers. 
F Arams	1967	For contributions to microwave quantum devices. 
Aristotle Arapostathis	2007	For contributions in nonlinear and stochastic control and applications in power systems 
