Fellow,Year,Country,University,Citation
Junshan Zhang,2012,United States,Arizona State University,For contributions to cross-layer optimization of wireless networks
Lei Zhang,2020,China,Tongji University,For contributions to large-scale visual recognition and multimedia information retrieval
Liangjie Zhang,2011,China,Huawei,For contributions to service-oriented technologies and applications
Mengjie Zhang,2019,New Zealand,Victoria University of Wellington,For contributions to evolutionary learning and optimization methodologies
Tong Zhang,2020,United States,Rensselaer Polytechnic Institute,For contributions to system design and VLSI implementation for data storage
Tong Zhang,2020,United States,Rensselaer Polytechnic Institute,For contributions to machine learning algorithms
Yan Zhang,2020,Norway,University of Oslo,For contributions to resource management in wireless networks
Zhili Zhang,2012,United States,University of Minnesota,For contributions to internet quality-of-service theory and applications
Zhongfei Zhang,2020,United States,"Binghamton University, SUNY",For contributions to multimodal data content understanding and mining
Lin Zhong,2019,United States,Yale University,For contributions to the development of energy-efficient driver circuits for organic light-emitting diodes
Gang Zhou,2023,United States,College of William and Mary,For contributions to sensor networks and low-power wireless networks
Jingren Zhou,2019,China,Alibaba Group,For contributions to cloud computing and query processing
Xiaofang Zhou,2018,Australia,The University of Queensland,For advancements in database query processing
Zhi-Hua Zhou,2013,China,Nanjing University,For contributions to learning systems in data mining and pattern recognition
Ce Zhu,2017,China,University of Electronic Science and Technology of China,For contributions to video coding and communications
Haojin Zhu,2023,China,Shanghai Jiao Tong University,For contributions to Vehicular Networks and Internet-of-Things Security
Wenwu Zhu,2010,China,Tsinghua University,For contributions to video communications over the internet and wireless
Xingquan Zhu,2023,United States,Florida Atlantic University,For contributions to data mining for big data analytics and network representation learning
Thomas Zimmermann,2021,United States,Microsoft Research,"For contributions to data science in software engineering, research and practice"
Chengqing Zong,2023,China,Chinese Academy of Sciences,For contributions to machine translation and natural language processing
Michael Zyda,2019,United States,University of Southern California,For contributions to game design and networking
